{"$schema":"../../../../../schemas/mechanic.schema.json","schemaVersion":1,"recordType":"mechanic","id":"murder-row/xathuux-the-annihilator/demonic-rage-474197","status":"draft","validity":{"fromBuild":"12.1.0.69587","untilBuild":null,"seasonId":null,"seasonSlug":"midnight-season-2"},"encounter":{"instanceId":2813,"encounterId":3103,"npcId":234647},"mechanic":{"spellId":474197,"category":"positioning","summary":"A damage event starts an attack-speed and boss-vulnerability phase that leaves persistent Burning Steps pools.","response":"Kite the boss around the arena edge, maximize damage during the vulnerability, and preserve central space."},"roles":["tank","healer","damage"],"specIds":[],"provenance":[{"kind":"external-reference","description":"Compact tactical classification from Wowhead's Patch 12.1 Murder Row guide and linked spell record.","url":"https://www.wowhead.com/spell=474197/demonic-rage","retrievedAt":"2026-09-02T14:05:00+02:00"}]}
