{"$schema":"../../../../../schemas/mechanic.schema.json","schemaVersion":1,"recordType":"mechanic","id":"murder-row/xathuux-the-annihilator/axe-toss-1214663","status":"draft","validity":{"fromBuild":"12.1.0.69587","untilBuild":null,"seasonId":null,"seasonSlug":"midnight-season-2"},"encounter":{"instanceId":2813,"encounterId":3103,"npcId":234647},"mechanic":{"spellId":1214663,"category":"positioning","summary":"A targeted axe impact leaves an attackable object that stacks group-wide Fel Lightning.","response":"Place the impact near melee without overlapping players, then destroy the axe immediately."},"roles":["tank","healer","damage"],"specIds":[],"provenance":[{"kind":"external-reference","description":"Compact tactical classification from Wowhead's Patch 12.1 Murder Row guide and linked spell record.","url":"https://www.wowhead.com/spell=1214663/axe-toss","retrievedAt":"2026-09-02T14:05:00+02:00"}]}
