{"$schema":"../../../../../schemas/mechanic.schema.json","schemaVersion":1,"recordType":"mechanic","id":"kings-rest/council-of-tribes/poison-nova-267273","status":"draft","validity":{"fromBuild":"12.1.0.69587","untilBuild":null,"seasonId":null,"seasonSlug":"midnight-season-2"},"encounter":{"instanceId":1762,"encounterId":2140,"npcId":135475,"actorNpcId":269810},"mechanic":{"spellId":267273,"category":"interrupt","summary":"Zanazal casts a long Poison Nova that applies sustained Nature damage to the entire group.","response":"Assign an interrupt and stop every cast; use poison removal only as recovery after a missed kick."},"roles":["tank","healer","damage"],"specIds":[],"provenance":[{"kind":"external-reference","description":"Current Patch 12.1 tactical classification from Wowhead's King's Rest guide.","url":"https://www.wowhead.com/ptr-2/spell=267273/poison-nova","retrievedAt":"2026-09-02T17:05:00+02:00"},{"kind":"local-client","description":"Spell, interrupt flag, poison flag, and actor identifiers corroborated in installed Mythic Dungeon Tools 6.2.10 Retail data.","url":"https://github.com/Nnoggie/MythicDungeonTools","retrievedAt":"2026-09-02T17:05:00+02:00"}]}
