{
  "$schema": "../../../../../schemas/mechanic.schema.json",
  "schemaVersion": 1,
  "recordType": "mechanic",
  "id": "altar-of-fangs/the-writhing-coil/assimilation-1300686",
  "status": "draft",
  "validity": { "fromBuild": "12.1.0.69587", "untilBuild": null, "seasonId": null, "seasonSlug": "midnight-season-2" },
  "encounter": { "instanceId": 2993, "encounterId": 3457, "npcId": 259446 },
  "mechanic": { "spellId": 1300686, "category": "damage", "summary": "Assimilation creates a priority target change.", "response": "Switch damage to the spawned or empowered target; exact target requires verification." },
  "roles": ["tank", "healer", "damage"],
  "specIds": [],
  "provenance": [{ "kind": "external-reference", "description": "Draft classification inferred from DBM Dungeons r261 alert metadata; not yet independently verified by WHELP.", "url": "https://github.com/DeadlyBossMods/DBM-Dungeons/blob/master/DBM-Party-Midnight/AltarofFangs/TheWrithingCoil.lua", "retrievedAt": "2026-09-02T10:30:00+02:00" }]
}
