{"$schema":"../../../../../schemas/mechanic.schema.json","schemaVersion":1,"recordType":"mechanic","id":"temple-of-sethraliss/avatar-of-sethraliss/defiling-taint-1301199","status":"draft","validity":{"fromBuild":"12.1.0.69587","untilBuild":null,"seasonId":null,"seasonSlug":"midnight-season-2"},"encounter":{"instanceId":1877,"encounterId":2127,"npcId":133392,"actorNpcId":268427},"mechanic":{"spellId":1301199,"category":"damage","summary":"Essence Defilers channel on the Avatar and prevent all external healing while any channel remains.","response":"Group and eliminate every Essence Defiler before committing major healing to the Avatar."},"roles":["tank","healer","damage"],"specIds":[],"provenance":[{"kind":"external-reference","description":"Current Patch 12.1 tactical classification from Wowhead's Temple guide.","url":"https://www.wowhead.com/ptr/spell=1301199/defiling-taint","retrievedAt":"2026-09-02T16:20:00+02:00"},{"kind":"local-client","description":"Spell and actor NPC identifiers corroborated in installed Mythic Dungeon Tools 6.2.10 Retail data.","url":"https://github.com/Nnoggie/MythicDungeonTools","retrievedAt":"2026-09-02T16:20:00+02:00"}]}
