{"$schema":"../../../../../schemas/mechanic.schema.json","schemaVersion":1,"recordType":"mechanic","id":"voidscar-arena/atroxus/monstrous-roar-1262497","status":"draft","validity":{"fromBuild":"12.1.0.69587","untilBuild":null,"seasonId":null,"seasonSlug":"midnight-season-2"},"encounter":{"instanceId":2923,"encounterId":3286,"npcId":239008},"mechanic":{"spellId":1262497,"category":"damage","summary":"Group-wide physical damage that ignores armor also causes a Toxic Creeper to emerge and fixate a player.","response":"Prepare healing for the roar, immediately focus the creeper, and keep it from biting its fixate target."},"roles":["tank","healer","damage"],"specIds":[],"provenance":[{"kind":"external-reference","description":"Compact tactical classification from Wowhead's Patch 12.1 Voidscar Arena guide and linked spell record.","url":"https://www.wowhead.com/spell=1262497/monstrous-roar","retrievedAt":"2026-09-02T15:10:00+02:00"}]}
