{"$schema":"../../../../../schemas/mechanic.schema.json","schemaVersion":1,"recordType":"mechanic","id":"murder-row/zaen-bladesorrow/fel-infused-freight-1201553","status":"draft","validity":{"fromBuild":"12.1.0.69587","untilBuild":null,"seasonId":null,"seasonSlug":"midnight-season-2"},"encounter":{"instanceId":2813,"encounterId":3102,"npcId":234649},"mechanic":{"spellId":1201553,"category":"damage","summary":"Fel-infused freight applies repeating party damage while it remains active.","response":"Destroy the dangerous freight without consuming the final cover needed for Murder in a Row."},"roles":["healer","damage"],"specIds":[],"provenance":[{"kind":"external-reference","description":"Compact tactical classification from Wowhead's Patch 12.1 Murder Row guide and linked spell record.","url":"https://www.wowhead.com/spell=1201553/fel-infused-freight","retrievedAt":"2026-09-02T14:05:00+02:00"}]}
