{"$schema":"../../../../../schemas/mechanic.schema.json","schemaVersion":1,"recordType":"mechanic","id":"temple-of-sethraliss/adderis-and-aspix/gale-force-1289062","status":"draft","validity":{"fromBuild":"12.1.0.69587","untilBuild":null,"seasonId":null,"seasonSlug":"midnight-season-2"},"encounter":{"instanceId":1877,"encounterId":2124,"npcId":133379,"actorNpcId":262822},"mechanic":{"spellId":1289062,"category":"positioning","summary":"Aspix damages and forcefully pushes players away.","response":"Spread, face the push toward safe ground, and avoid being displaced through Tempest Winds zones or too far from the next group soak."},"roles":["tank","healer","damage"],"specIds":[],"provenance":[{"kind":"external-reference","description":"Current Patch 12.1 tactical classification from Wowhead's Temple guide.","url":"https://www.wowhead.com/ptr/spell=1289062/gale-force","retrievedAt":"2026-09-02T16:20:00+02:00"},{"kind":"local-client","description":"Spell and actor NPC identifiers corroborated in installed Mythic Dungeon Tools 6.2.10 Retail data.","url":"https://github.com/Nnoggie/MythicDungeonTools","retrievedAt":"2026-09-02T16:20:00+02:00"}]}
