{"$schema":"../../../../../schemas/mechanic.schema.json","schemaVersion":1,"recordType":"mechanic","id":"den-of-nalorakk/the-hoardmonger/spoiled-supplies-1234233","status":"draft","validity":{"fromBuild":"12.1.0.69587","untilBuild":null,"seasonId":null,"seasonSlug":"midnight-season-2"},"encounter":{"instanceId":2825,"encounterId":3207,"npcId":248710},"mechanic":{"spellId":1234233,"category":"positioning","summary":"Rotten mushrooms grow and later burst into group-wide poison if not cleared.","response":"Assign players to touch mushrooms before they mature; stagger contacts to limit stacked Toxic Spores and use poison removal."},"roles":["tank","healer","damage"],"specIds":[],"provenance":[{"kind":"external-reference","description":"Compact tactical classification from Wowhead's Patch 12.1 Den of Nalorakk dungeon guide.","url":"https://www.wowhead.com/guide/midnight/den-of-nalorakk-dungeon-overview-location-rewards","retrievedAt":"2026-09-02T13:35:00+02:00"}]}
