{"$schema":"../../../../../schemas/mechanic.schema.json","schemaVersion":1,"recordType":"mechanic","id":"kings-rest/mchimba-the-embalmer/entomb-267702","status":"draft","validity":{"fromBuild":"12.1.0.69587","untilBuild":null,"seasonId":null,"seasonSlug":"midnight-season-2"},"encounter":{"instanceId":1762,"encounterId":2142,"npcId":134993},"mechanic":{"spellId":267702,"category":"control","summary":"A player is sealed in one coffin while Mchimba begins opening the unoccupied coffins in sequence.","response":"Identify and click the occupied coffin quickly to free the player and stop additional Finished Mummies from being released."},"roles":["tank","healer","damage"],"specIds":[],"provenance":[{"kind":"external-reference","description":"Current Patch 12.1 tactical classification from Wowhead's King's Rest guide.","url":"https://www.wowhead.com/ptr-2/spell=267702/entomb","retrievedAt":"2026-09-02T17:05:00+02:00"},{"kind":"local-client","description":"Spell and actor identifiers corroborated in installed Mythic Dungeon Tools 6.2.10 Retail data.","url":"https://github.com/Nnoggie/MythicDungeonTools","retrievedAt":"2026-09-02T17:05:00+02:00"}]}
