{"$schema":"../../../../../schemas/mechanic.schema.json","schemaVersion":1,"recordType":"mechanic","id":"the-blinding-vale/lightwarden-ruia/pulverizing-strikes-1240210","status":"draft","validity":{"fromBuild":"12.1.0.69587","untilBuild":null,"seasonId":null,"seasonSlug":"midnight-season-2"},"encounter":{"instanceId":2859,"encounterId":3201,"npcId":245912},"mechanic":{"spellId":1240210,"category":"positioning","summary":"Ruia locks repeated frontal cones onto several marked players; successive hits amplify later cone damage.","response":"Spread cone directions away from allies, then stand still after targeting locks to avoid sweeping the cone through teammates."},"roles":["tank","healer","damage"],"specIds":[],"provenance":[{"kind":"external-reference","description":"Compact tactical classification from Wowhead's Patch 12.1 Blinding Vale guide and linked spell record.","url":"https://www.wowhead.com/spell=1240210/pulverizing-strikes","retrievedAt":"2026-09-02T14:40:00+02:00"}]}
