{"$schema":"../../../../../schemas/mechanic.schema.json","schemaVersion":1,"recordType":"mechanic","id":"den-of-nalorakk/nalorakk/overwhelming-onslaught-1297792","status":"draft","validity":{"fromBuild":"12.1.0.69587","untilBuild":null,"seasonId":null,"seasonSlug":"midnight-season-2"},"encounter":{"instanceId":2825,"encounterId":3209,"npcId":246404},"mechanic":{"spellId":1297792,"category":"positioning","summary":"A sequence of heavy group-wide physical hits that ignores armor.","response":"Stand behind Zul'jarra to receive Defensive Stance's reduction and use defensives while healing through the remaining damage."},"roles":["tank","healer","damage"],"specIds":[],"provenance":[{"kind":"external-reference","description":"Compact tactical classification from Wowhead's Patch 12.1 Den guide and linked spell record.","url":"https://www.wowhead.com/spell=1297792/overwhelming-onslaught","retrievedAt":"2026-09-02T13:35:00+02:00"}]}
