{"$schema":"../../../../../schemas/mechanic.schema.json","schemaVersion":1,"recordType":"mechanic","id":"temple-of-sethraliss/adderis-and-aspix/storm-blessed-1289229","status":"draft","validity":{"fromBuild":"12.1.0.69587","untilBuild":null,"seasonId":null,"seasonSlug":"midnight-season-2"},"encounter":{"instanceId":1877,"encounterId":2124,"npcId":133379},"mechanic":{"spellId":1289229,"category":"damage","summary":"The duo transfers complete damage immunity between partners as their health changes.","response":"Swap damage immediately to the unblessed target and plan to finish the pair close together to limit the survivor's frenzy."},"roles":["damage"],"specIds":[],"provenance":[{"kind":"external-reference","description":"Current Patch 12.1 tactical classification from Wowhead's Temple guide.","url":"https://www.wowhead.com/ptr/spell=1289229/storm-blessed","retrievedAt":"2026-09-02T16:20:00+02:00"},{"kind":"local-client","description":"Spell identifier corroborated in installed Mythic Dungeon Tools 6.2.10 Retail data.","url":"https://github.com/Nnoggie/MythicDungeonTools","retrievedAt":"2026-09-02T16:20:00+02:00"}]}
