{"$schema":"../../../../../schemas/mechanic.schema.json","schemaVersion":1,"recordType":"mechanic","id":"voidscar-arena/tazrah/dark-bloom-1300259","status":"draft","validity":{"fromBuild":"12.1.0.69587","untilBuild":null,"seasonId":null,"seasonSlug":"midnight-season-2"},"encounter":{"instanceId":2923,"encounterId":3285,"npcId":238887},"mechanic":{"spellId":1300259,"category":"movement","summary":"A group-wide shadow hit causes existing Void Fissures to erupt into damaging projectiles.","response":"Prepare healing for the initial hit and watch the fissures so the party can dodge the resulting orbs."},"roles":["tank","healer","damage"],"specIds":[],"provenance":[{"kind":"external-reference","description":"Compact tactical classification from Wowhead's Patch 12.1 Voidscar Arena guide and linked spell record.","url":"https://www.wowhead.com/spell=1300259/dark-bloom","retrievedAt":"2026-09-02T15:10:00+02:00"}]}
