{"$schema":"../../../../../schemas/mechanic.schema.json","schemaVersion":1,"recordType":"mechanic","id":"the-blinding-vale/ziekket/awaken-the-lightbloom-1246372","status":"draft","validity":{"fromBuild":"12.1.0.69587","untilBuild":null,"seasonId":null,"seasonSlug":"midnight-season-2"},"encounter":{"instanceId":2859,"encounterId":3202,"npcId":247676},"mechanic":{"spellId":1246372,"category":"damage","summary":"Ziekket summons Lightspawn Lashers and reawakens any dormant lashers with increased power and control immunity.","response":"Group and kill lashers quickly, then use Concentrated Lightbeam to remove their dormant corpses before the next awakening."},"roles":["tank","healer","damage"],"specIds":[],"provenance":[{"kind":"external-reference","description":"Compact tactical classification from Wowhead's Patch 12.1 Blinding Vale guide and linked spell record.","url":"https://www.wowhead.com/spell=1246372/awaken-the-lightbloom","retrievedAt":"2026-09-02T14:40:00+02:00"}]}
