{"$schema":"../../../../../schemas/mechanic.schema.json","schemaVersion":1,"recordType":"mechanic","id":"den-of-nalorakk/nalorakk/fury-of-the-war-god-1243002","status":"draft","validity":{"fromBuild":"12.1.0.69587","untilBuild":null,"seasonId":null,"seasonSlug":"midnight-season-2"},"encounter":{"instanceId":2825,"encounterId":3209,"npcId":246404},"mechanic":{"spellId":1243002,"category":"positioning","summary":"Existing bear echoes charge the incapacitated Zul'jarra and collide with the first player in their path.","response":"Assign players to intercept every charging echo before it reaches Zul'jarra; plan for echoes to persist into one additional cycle."},"roles":["tank","healer","damage"],"specIds":[],"provenance":[{"kind":"external-reference","description":"Compact tactical classification from Wowhead's Patch 12.1 Den guide and linked spell record.","url":"https://www.wowhead.com/spell=1243002/fury-of-the-war-god","retrievedAt":"2026-09-02T13:35:00+02:00"}]}
