{"$schema":"../../../../../schemas/mechanic.schema.json","schemaVersion":1,"recordType":"mechanic","id":"murder-row/lithiel-cinderfury/summon-vilefiend-474408","status":"draft","validity":{"fromBuild":"12.1.0.69587","untilBuild":null,"seasonId":null,"seasonSlug":"midnight-season-2"},"encounter":{"instanceId":2813,"encounterId":3105,"npcId":237415},"mechanic":{"spellId":474408,"category":"damage","summary":"Lithiel summons a dangerous melee add that can be empowered by Malefic Wave.","response":"Focus the Vilefiend and kill it before Malefic Wave reaches it."},"roles":["tank","healer","damage"],"specIds":[],"provenance":[{"kind":"external-reference","description":"Compact tactical classification from Wowhead's Patch 12.1 Murder Row guide and linked spell record.","url":"https://www.wowhead.com/spell=474408/summon-vilefiend","retrievedAt":"2026-09-02T14:05:00+02:00"}]}
