{"$schema":"../../../../../schemas/mechanic.schema.json","schemaVersion":1,"recordType":"mechanic","id":"kings-rest/mchimba-the-embalmer/burn-corruption-267639","status":"draft","validity":{"fromBuild":"12.1.0.69587","untilBuild":null,"seasonId":null,"seasonSlug":"midnight-season-2"},"encounter":{"instanceId":1762,"encounterId":2142,"npcId":134993},"mechanic":{"spellId":267639,"category":"positioning","summary":"Purifying flames target a player, deal impact damage, and leave Burning Ground.","response":"Move away from allies and place the patch at the room edge to preserve space around the coffins."},"roles":["healer","damage"],"specIds":[],"provenance":[{"kind":"external-reference","description":"Current Patch 12.1 tactical classification from Wowhead's King's Rest guide.","url":"https://www.wowhead.com/ptr-2/spell=267639/burn-corruption","retrievedAt":"2026-09-02T17:05:00+02:00"},{"kind":"local-client","description":"Spell and actor identifiers corroborated in installed Mythic Dungeon Tools 6.2.10 Retail data.","url":"https://github.com/Nnoggie/MythicDungeonTools","retrievedAt":"2026-09-02T17:05:00+02:00"}]}
