{"$schema":"../../../../../schemas/mechanic.schema.json","schemaVersion":1,"recordType":"mechanic","id":"temple-of-sethraliss/merektha/a-knot-of-snakes-1290031","status":"draft","validity":{"fromBuild":"12.1.0.69587","untilBuild":null,"seasonId":null,"seasonSlug":"midnight-season-2"},"encounter":{"instanceId":1877,"encounterId":2125,"npcId":133384},"mechanic":{"spellId":1290031,"category":"control","summary":"A knot of snakes incapacitates a marked player until the knot is destroyed or itself incapacitated.","response":"Group near the indicated target before application, then use area crowd control or focused damage to free them immediately."},"roles":["tank","healer","damage"],"specIds":[],"provenance":[{"kind":"external-reference","description":"Current Patch 12.1 tactical classification from Wowhead's Temple guide.","url":"https://www.wowhead.com/ptr/spell=1290031/a-knot-of-snakes","retrievedAt":"2026-09-02T16:20:00+02:00"},{"kind":"local-client","description":"Spell identifier corroborated in installed Mythic Dungeon Tools 6.2.10 Retail data.","url":"https://github.com/Nnoggie/MythicDungeonTools","retrievedAt":"2026-09-02T16:20:00+02:00"}]}
