{"$schema":"../../../../../schemas/mechanic.schema.json","schemaVersion":1,"recordType":"mechanic","id":"kings-rest/the-golden-serpent/tail-thrash-265910","status":"draft","validity":{"fromBuild":"12.1.0.69587","untilBuild":null,"seasonId":null,"seasonSlug":"midnight-season-2"},"encounter":{"instanceId":1762,"encounterId":2139,"npcId":135322},"mechanic":{"spellId":265910,"category":"defensive","summary":"A heavy strike hits the boss's current target.","response":"The tank should use active mitigation or a defensive and avoid overlapping the hit with dangerous add pressure."},"roles":["tank","healer"],"specIds":[],"provenance":[{"kind":"external-reference","description":"Current Patch 12.1 tactical classification from Wowhead's King's Rest guide.","url":"https://www.wowhead.com/ptr-2/spell=265910/tail-thrash","retrievedAt":"2026-09-02T16:30:00+02:00"},{"kind":"local-client","description":"Spell and actor identifiers corroborated in installed Mythic Dungeon Tools 6.2.10 Retail data.","url":"https://github.com/Nnoggie/MythicDungeonTools","retrievedAt":"2026-09-02T16:30:00+02:00"}]}
