{"$schema":"../../../../../schemas/mechanic.schema.json","schemaVersion":1,"recordType":"mechanic","id":"temple-of-sethraliss/merektha/hatch-1289205","status":"draft","validity":{"fromBuild":"12.1.0.69587","untilBuild":null,"seasonId":null,"seasonSlug":"midnight-season-2"},"encounter":{"instanceId":1877,"encounterId":2125,"npcId":133384},"mechanic":{"spellId":1289205,"category":"damage","summary":"Merektha hatches eggs and releases hostile snakes into the encounter.","response":"Group and eliminate the spawned snakes with area damage while preserving interrupts for Poison Spit."},"roles":["tank","healer","damage"],"specIds":[],"provenance":[{"kind":"external-reference","description":"Current Patch 12.1 tactical classification from Wowhead's Temple guide.","url":"https://www.wowhead.com/ptr/spell=1289205/hatch","retrievedAt":"2026-09-02T16:20:00+02:00"},{"kind":"local-client","description":"Spell identifier corroborated in installed Mythic Dungeon Tools 6.2.10 Retail data.","url":"https://github.com/Nnoggie/MythicDungeonTools","retrievedAt":"2026-09-02T16:20:00+02:00"}]}
