{"$schema":"../../../../../schemas/mechanic.schema.json","schemaVersion":1,"recordType":"mechanic","id":"kings-rest/council-of-tribes/barrel-through-267494","status":"draft","validity":{"fromBuild":"12.1.0.69587","untilBuild":null,"seasonId":null,"seasonSlug":"midnight-season-2"},"encounter":{"instanceId":1762,"encounterId":2140,"npcId":135475,"actorNpcId":269808},"mechanic":{"spellId":267494,"category":"positioning","summary":"Aka'ali charges a marked player for heavy physical damage split among players struck.","response":"Stack in the charge path to share the hit, then separate for the next mechanic."},"roles":["tank","healer","damage"],"specIds":[],"provenance":[{"kind":"external-reference","description":"Current Patch 12.1 tactical classification from Wowhead's King's Rest guide.","url":"https://www.wowhead.com/ptr-2/spell=267494/barrel-through","retrievedAt":"2026-09-02T17:05:00+02:00"},{"kind":"local-client","description":"Spell and actor identifiers corroborated in installed Mythic Dungeon Tools 6.2.10 Retail data.","url":"https://github.com/Nnoggie/MythicDungeonTools","retrievedAt":"2026-09-02T17:05:00+02:00"}]}
